<?XML version="1.0" encodage="UTF-8"?>
<!DOCTYPE repertoire SYSTEM "ClientDTD.dtd">
<Clients>
    <Client id="0854125">
        <Nom>Bouchard</Nom>
        <Prenom>Théo</Prenom>
        <Naissance>05/02/1965</Naissance>
        <Telephone>XXXXXXXXXX</Telephone>
        <MotDePasse>Michel Forever Tonight !</MotDePasse>
        <Adresse>
            <Numero>25</Numero>
            <NomRue>Rue de la 57ème Licorne</NomRue>
            <CodePostal>78564</CodePostal>
            <Ville>Pays du Nuage</Ville>
        </Adresse>
        <Mail>mail@mail.com</Mail>
        <Historique>
            <!-- L'id fait référence aux livres dans Book.xml-->
            <Livre id ="bk101"/>
        </Historique>
    </Client>
    <Client id="0854126">
        <Name>Doe</Name>
        <Prenom>Jhon</Prenom>
        <Naissance>Unknow</Naissance>
        <Telephone>Anonym</Telephone>
        <MotDePasse>I am hidding !</MotDePasse>
        <Adresse>
            <NomRue>He'll found you !</NomRue>
            <CodePostal>25007</CodePostal>
            <Ville>NoWhere</Ville>
        </Adresse>
        <Mail>secretAgent@Iamasecretagent.com</Mail>
        <Historique>
            <Livre id ="bk101"/>
            <Livre id ="bk102"/>
        </Historique>
    </Client>
</Clients>